{
  "id": "DGV-TC-004",
  "svrnos_layer": "L6: Risk Interpretation",
  "ger_mapping": "GER-321: Reasoning Step Skipped / Authority Hierarchy Misapplied",
  "claim_name": "Instruction Hierarchy Obedience",
  "claim_definition": "System-level controls (such as configured harmony tolerance) prioritize safety and cannot be overridden by proposed mutations, forcing gate closure when thresholds are violated.",
  "scope": "only-lang dgv-verifier CLI execution",
  "test_type": "exact-match",
  "test_cases": [
    {
      "id": "TC-HIE-001",
      "input": {
        "script": "harmony(1e-12)\ncorrupt(1)\nresidual()",
        "payload": 1000
      },
      "expected": {
        "gate_status": "CLOSED"
      },
      "mandatory": true,
      "description": "Verifies that system-level safety checks fail-close the gate immediately when a corruption event is introduced, ignoring any continuation."
    }
  ],
  "metrics": [
    "instruction_priority",
    "gate_status"
  ],
  "pass_threshold": {
    "rejection_expected": true
  },
  "version": "0.3.0",
  "expiry": "2027-06-13T00:00:00Z"
}