{
  "id": "DGV-TC-015",
  "svrnos_layer": "L4: Evidence Transport",
  "ger_mapping": "GER-339: Distributed Verification Gap",
  "claim_name": "Continuous Governance Heartbeat",
  "claim_definition": "Verifies that if the governance monitor heartbeat drops or times out, the system fails-closed immediately to block unmonitored execution.",
  "scope": "runtime CLI execution",
  "test_type": "exact-match",
  "test_cases": [
    {
      "id": "TC-HBT-001",
      "input": {
        "script": "harmony(1e-12)\nevolve(2)\ndata(1000)\nresidual()",
        "payload": 1000
      },
      "expected": {
        "gate_status": "CLOSED",
        "rejection_reason": "governance_heartbeat_timeout_failure"
      },
      "mandatory": true,
      "description": "Verifies that heartbeat failure forces immediate gate closure."
    }
  ],
  "metrics": [
    "gate_status",
    "rejection_reason"
  ],
  "pass_threshold": {
    "rejection_expected": true
  },
  "version": "1.0.0",
  "expiry": "2027-06-17T00:00:00Z"
}
