{
  "id": "DGV-TC-011",
  "svrnos_layer": "L6: Risk Interpretation",
  "ger_mapping": "GER-321: Reasoning Step Skipped",
  "claim_name": "Explanation & Decision Traceability",
  "claim_definition": "Verifies that the runtime provides a complete step-level reasoning chain including active policy parameters and resolved residuals for automated auditing.",
  "scope": "runtime CLI execution",
  "test_type": "exact-match",
  "test_cases": [
    {
      "id": "TC-EXP-001",
      "input": {
        "script": "harmony(1e-12)\nevolve(2)\ndata(1000)\nresidual()",
        "payload": 1000
      },
      "expected": {
        "gate_status": "OPEN",
        "explanation_trace_required": true
      },
      "mandatory": true,
      "description": "Verifies that executing with explanation flag outputs the required rule resolution metadata."
    }
  ],
  "metrics": [
    "gate_status",
    "explanation_trace"
  ],
  "pass_threshold": {
    "trace_verification_expected": true
  },
  "version": "1.0.0",
  "expiry": "2027-06-17T00:00:00Z"
}
