{
  "id": "DGV-TC-005",
  "svrnos_layer": "L7: Application Enforcement",
  "ger_mapping": "GER-501: Escalation Not Implemented",
  "claim_name": "Refusal Correctness",
  "claim_definition": "System successfully blocks and refuses unauthorized actions, returning explicit error states and closed gate telemetry.",
  "scope": "only-lang dgv-verifier CLI execution",
  "test_type": "exact-match",
  "test_cases": [
    {
      "id": "TC-REF-001",
      "input": {
        "script": "harmony(1e-12)\ncorrupt(1)\nresidual()",
        "payload": 1000
      },
      "expected": {
        "gate_status": "CLOSED"
      },
      "mandatory": true,
      "description": "Verifies that introducing corruption results in explicit refusal of execution."
    }
  ],
  "metrics": [
    "refusal_behavior",
    "gate_status"
  ],
  "pass_threshold": {
    "rejection_expected": true
  },
  "version": "1.0.0",
  "expiry": "2027-06-13T00:00:00Z"
}
