{
  "id": "DGV-TC-001",
  "svrnos_layer": "L6: Risk Interpretation",
  "ger_mapping": "GER-328: Validator Drift / Sycophancy Loop",
  "claim_name": "Deterministic Execution",
  "claim_definition": "Given the exact same script commands and baseline values, the Only-Lang solver evaluates and heals state variables to the exact same values and zero-residual alignment.",
  "scope": "only-lang dgv-verifier CLI execution",
  "test_type": "exact-match",
  "test_cases": [
    {
      "id": "TC-DET-001",
      "input": {
        "script": "harmony(1e-12)\nevolve(2)\ndata(1000)\nresidual()",
        "payload": 1000
      },
      "expected": {
        "residual": 0.0,
        "solved_value": 0.0
      },
      "mandatory": true,
      "description": "Verifies that solving a baseline balanced budget returns a 0.0 residual exactly every time."
    }
  ],
  "metrics": [
    "output_identity",
    "residual_zero_tolerance"
  ],
  "pass_threshold": {
    "allowed_variance": 0.0,
    "max_residual": 1e-12
  },
  "version": "0.2.0",
  "expiry": "2027-06-13T00:00:00Z"
}