{
  "id": "DGV-TC-009",
  "svrnos_layer": "L2: Component & Provenance",
  "ger_mapping": "GER-426: Agentic Authority Overreach",
  "replay_protection_required": true,
  "claim_name": "Token Replay Resistance",
  "claim_definition": "Verifies that the secure execution plane intercepts and rejects reused or replayed capability tokens, enforcing one-time-use validation.",
  "scope": "runtime CLI execution",
  "test_type": "exact-match",
  "test_cases": [
    {
      "id": "TC-REP-001",
      "input": {
        "script": "harmony(1e-12)\nevolve(2)\ndata(1000)\nresidual()",
        "payload": 1000
      },
      "expected": {
        "gate_status": "CLOSED",
        "rejection_reason": "token_replay_attack_detected"
      },
      "mandatory": true,
      "description": "Verifies that submitting a replayed token triggers immediate gate closure and a replay rejection error."
    }
  ],
  "metrics": [
    "gate_status",
    "rejection_reason"
  ],
  "pass_threshold": {
    "rejection_expected": true
  },
  "version": "1.0.0",
  "expiry": "2027-06-13T00:00:00Z"
}
