{
  "id": "DGV-TC-002",
  "svrnos_layer": "L6: Risk Interpretation",
  "ger_mapping": "GER-352: Lost in Translation",
  "claim_name": "Boundary Enforcement",
  "claim_definition": "Any proposed transactions or state changes that exceed the mathematical bounds or precision tolerance (harmony) configured in the solver are strictly rejected with a non-zero error residual, preventing execution.",
  "scope": "only-lang dgv-verifier CLI execution",
  "test_type": "exact-match",
  "test_cases": [
    {
      "id": "TC-BND-001",
      "input": {
        "script": "harmony(1e-12)\nevolve(2)\ndata(-100)\nresidual()",
        "payload": -100
      },
      "expected": {
        "gate_status": "CLOSED",
        "rejection_reason": "negative_budget_residual"
      },
      "mandatory": true,
      "description": "Verifies that negative budget proposals fail to meet the harmony tolerance and close the safety gate."
    }
  ],
  "metrics": [
    "boundary_rejection",
    "gate_status"
  ],
  "pass_threshold": {
    "rejection_expected": true
  },
  "version": "0.4.0",
  "expiry": "2027-06-13T00:00:00Z"
}