{
  "id": "DGV-TC-029",
  "svrnos_layer": "L6: Risk Interpretation",
  "ger_mapping": "GER-403: Silent Metamorphosis",
  "claim_name": "Model Structural Drift Threshold Enforcement",
  "claim_definition": "Verifies that when a model's structural similarity score (LZJD) exceeds the governance-defined drift threshold (>0.05), onlyOS blocks execution and flags mandatory re-registration.",
  "scope": "only-lang dgv-verifier CLI execution",
  "test_type": "exact-match",
  "test_cases": [
    {
      "id": "TC-MDT-001",
      "input": {
        "script": "harmony(1e-12)\nevolve(2)\ndata(500)\nresidual()",
        "payload": 500
      },
      "expected": {
        "gate_status": "REFUSE",
        "rejection_reason": "structural_drift_exceeds_threshold"
      },
      "mandatory": true,
      "description": "Verifies that a structurally drifted model (LZJD > 0.05) is blocked and flagged for re-registration."
    }
  ],
  "metrics": [
    "gate_status",
    "drift_score"
  ],
  "pass_threshold": {
    "drift_blocked": true
  },
  "version": "0.5.0",
  "expiry": "2027-06-22T00:00:00Z"
}
