{
  "id": "DGV-TC-014",
  "svrnos_layer": "L2: Component & Provenance",
  "ger_mapping": "GER-415: Unauthorized Output Signature",
  "claim_name": "Cryptographic Provenance Watermarking",
  "claim_definition": "Verifies that the runtime signs output states with cryptographically verifiable signatures for tamper protection.",
  "scope": "runtime CLI execution",
  "test_type": "exact-match",
  "test_cases": [
    {
      "id": "TC-PRV-001",
      "input": {
        "script": "harmony(1e-12)\nevolve(2)\ndata(1000)\nresidual()",
        "payload": 1000
      },
      "expected": {
        "gate_status": "OPEN",
        "provenance_verified": true
      },
      "mandatory": true,
      "description": "Verifies that outputs are emitted with valid cryptographic signature envelopes."
    }
  ],
  "metrics": [
    "gate_status",
    "provenance_signature",
    "provenance_verified"
  ],
  "pass_threshold": {
    "signature_present": true
  },
  "version": "1.0.0",
  "expiry": "2027-06-17T00:00:00Z"
}
