{
  "id": "DGV-TC-046",
  "svrnos_layer": "L4: Evidence Transport",
  "ger_mapping": "GER-401-TRANSPORT-TAMPERING",
  "replay_protection_required": true,
  "latency_threshold_ms": 100,
  "claim_name": "Streaming Integrity Verification",
  "claim_definition": "Test on-the-fly SHA-256 during transport (with hash cache optimization) to ensure no bits are modified in transit.",
  "scope": "Data transport, stream hashing.",
  "excluded_scope": "At-rest encryption.",
  "test_type": "exact-match",
  "enforcement_layer": {
    "enforcement_type": "distributed",
    "expected_verdict": "allow"
  },
  "required_preconditions": [
    "tls_channel_established"
  ],
  "threat_model_tie_in": [
    "Man-in-the-middle attacks",
    "Silent data corruption in transit"
  ],
  "test_cases": [
    {
      "id": "tc-046-01",
      "input": {
        "stream_id": "valid_stream",
        "hash_cache_hit": true
      },
      "expected": {
        "verdict": "allow",
        "integrity": "verified"
      },
      "mandatory": true,
      "description": "Stream integrity verified correctly."
    }
  ],
  "metrics": [
    "stream_hash_latency"
  ],
  "pass_threshold": {
    "stream_hash_latency": "< 100ms"
  },
  "evidence": "evidence/dgv_tc_046_receipt.json",
  "version": "1.0.0",
  "expiry": "2027-01-01T00:00:00Z"
}
