{
  "id": "DGV-TC-016",
  "svrnos_layer": "L2: Component & Provenance",
  "ger_mapping": "GER-426: Agentic Authority Overreach",
  "replay_protection_required": true,
  "claim_name": "Codon Delegation Lineage",
  "claim_definition": "Verifies that when an agent delegates permissions, the sub-proposal authority forms a strict sub-graph of the caller's verified codon lineage DAG.",
  "scope": "runtime CLI execution",
  "test_type": "exact-match",
  "test_cases": [
    {
      "id": "TC-CDG-001",
      "input": {
        "script": "harmony(1e-12)\nevolve(2)\ndata(1000)\nresidual()",
        "payload": 1000
      },
      "expected": {
        "gate_status": "CLOSED",
        "rejection_reason": "invalid_codon_delegation_lineage",
        "delegation_chain_valid": false,
        "scope_monotonic": false,
        "manifest_artifact_8_present": true
      },
      "mandatory": true,
      "description": "Verifies that presenting a forged or unlinked codon delegation lineage hash results in a closed gate."
    }
  ],
  "metrics": [
    "gate_status",
    "rejection_reason",
    "delegation_chain_valid",
    "scope_monotonic",
    "manifest_artifact_8_present"
  ],
  "pass_threshold": {
    "rejection_expected": true
  },
  "version": "1.0.0",
  "expiry": "2027-06-13T00:00:00Z"
}
